eis_url,Title,Document,EPA.Comment.Letter.Date,Federal.Register.Date,Agency,State,EIS_ID,EIS.Title,EIS.Number,Document.Type,EIS.Comment.Due..Review.Period.Date,Amended.Notice.Date,Amended.Notice,Supplemental.Information,Website,State.or.Territory,Lead.Agency,Contact.Name,Contact.Phone,Rating..if.Draft.EIS.,na_by_row,Issuance.of.Notice.of.Intent.to.Prepare.an.EIS.,Year,YEAR,AGENCY,PROJECT_ID,MASTER_ID
https://cdxnodengn.epa.gov/cdx-enepa-II/public/action/eis/details?eisId=261959,Final Integrated City of Norfolk Coastal Storm Risk Management Feasibility Study,Final,12/17/2018,11/16/2018,U.S. Army Corps of Engineers,VA,261959,Final Integrated City of Norfolk Coastal Storm Risk Management Feasibility Study,20180275,Final,2018-12-1700:00:00.0,"","","",,VA,U.S. Army Corps of Engineers,Katherine Perdue,757-201-7218,"",5,"",2018,2018,U.S. Army Corps of Engineers,20180275,20180275
https://cdxnodengn.epa.gov/cdx-enepa-II/public/action/eis/details?eisId=262361,The Flathead National Forest Land Management Plan and the NCDE Grizzly Bear Plan Amendments,Final,01/26/2019,11/23/2018,Forest Service,MT,262361,The Flathead National Forest Land Management Plan and the NCDE Grizzly Bear Plan Amendments,20180281,Final,2018-12-2400:00:00.0,"","","",,MT,Forest Service,Chip Weber,406-758-5204,"",5,"",2018,2018,Forest Service,20180281,20180281
https://cdxnodengn.epa.gov/cdx-enepa-II/public/action/eis/details?eisId=262401,"The Great Lakes and Mississippi River Interbasin Study - Brandon Road Integrated Feasibility Study and Environmental Impact Statement - Will County, Illinois",Final,12/21/2018,11/23/2018,U.S. Army Corps of Engineers,IL,262401,"The Great Lakes and Mississippi River Interbasin Study - Brandon Road Integrated Feasibility Study and Environmental Impact Statement - Will County, Illinois",20180282,Final,2019-02-2200:00:00.0,2019-02-0100:00:00.0,Revision to FR Notice Published 12/21/2018; Extending the Comment Period from 01/07/2019 to 02/22/2019.,"",,IL,U.S. Army Corps of Engineers,Andrew Leichty,309-794-5399,"",3,"",2018,2018,U.S. Army Corps of Engineers,20180282,20180282
https://cdxnodengn.epa.gov/cdx-enepa-II/public/action/eis/details?eisId=262700,Western Energy Company's Rosebud Mine Area F,Final,12/21/2018,11/30/2018,Department of Interior (other),MT,262700,Western Energy Company's Rosebud Mine Area F,20180288,Final,2018-12-3100:00:00.0,"","","",,MT,Office of Surface Mining,Logan Sholar,303-293-5036,"",5,"",2018,2018,Department of Interior (other),20180288,20180288
https://cdxnodengn.epa.gov/cdx-enepa-II/public/action/eis/details?eisId=262943,Idaho Greater Sage Grouse Proposed Resource Management Plan Amendment and Final Environmental Impact Statement,Final,12/20/2018,12/07/2018,Bureau of Land Management,ID,262943,Idaho Greater Sage Grouse Proposed Resource Management Plan Amendment and Final Environmental Impact Statement,20180293,Final,2019-01-0700:00:00.0,"","","",,ID,Bureau of Land Management,Jonathan Beck,208-373-3841,"",5,"",2018,2018,Bureau of Land Management,20180293,20180293
https://cdxnodengn.epa.gov/cdx-enepa-II/public/action/eis/details?eisId=262925,Nevada and Northeastern California Greater Sage-Grouse Proposed Resource Management Plan Amendment and Final Environmental Impact Statement,Final,"",12/07/2018,Bureau of Land Management,Multi,262925,Nevada and Northeastern California Greater Sage-Grouse Proposed Resource Management Plan Amendment and Final Environmental Impact Statement,20180294,Final,2019-01-0700:00:00.0,"","","",,NV-CA,Bureau of Land Management,Matt Magaletti,775-861-6400,"",6,"",2018,2018,Bureau of Land Management,20180294,20180294
https://cdxnodengn.epa.gov/cdx-enepa-II/public/action/eis/details?eisId=262968,Wyoming Greater Sage-Grouse Proposed Resource Management Plan Amendment and Final Environmental Impact Statement,Final,12/26/2018,12/07/2018,Bureau of Land Management,WY,262968,Wyoming Greater Sage-Grouse Proposed Resource Management Plan Amendment and Final Environmental Impact Statement,20180295,Final,2019-01-0700:00:00.0,"","","",,WY,Bureau of Land Management,Jennifer Fleuret,307-775-6329,"",5,"",2018,2018,Bureau of Land Management,20180295,20180295
https://cdxnodengn.epa.gov/cdx-enepa-II/public/action/eis/details?eisId=262976,Northwest Colorado Greater Sage-Grouse Proposed Resource Management Plan Amendment and Final Environmental Impact Statement,Final,12/28/2018,12/07/2018,Bureau of Land Management,CO,262976,Northwest Colorado Greater Sage-Grouse Proposed Resource Management Plan Amendment and Final Environmental Impact Statement,20180296,Final,2019-01-0700:00:00.0,"","","",,CO,Bureau of Land Management,Bridget Clayton,202-244-3045,"",5,"",2018,2018,Bureau of Land Management,20180296,20180296
https://cdxnodengn.epa.gov/cdx-enepa-II/public/action/eis/details?eisId=262994,Utah Greater Sage-Grouse Proposed Resource Management Plan Amendment and Final Environmental Impact Statement,Final,01/29/2019,12/07/2018,Bureau of Land Management,UT,262994,Utah Greater Sage-Grouse Proposed Resource Management Plan Amendment and Final Environmental Impact Statement,20180297,Final,2019-01-0700:00:00.0,"","","",,UT,Bureau of Land Management,Quincy Bahr,801-539-4122,"",5,"",2018,2018,Bureau of Land Management,20180297,20180297
https://cdxnodengn.epa.gov/cdx-enepa-II/public/action/eis/details?eisId=263015,Oregon Greater Sage-Grouse Proposed Resource Management Plan Amendment and Final Environmental Impact Statement,Final,12/20/2018,12/07/2018,Bureau of Land Management,OR,263015,Oregon Greater Sage-Grouse Proposed Resource Management Plan Amendment and Final Environmental Impact Statement,20180298,Final,2019-01-0700:00:00.0,"","","",,OR,Bureau of Land Management,James Regan-Vienop,503-808-6062,"",5,"",2018,2018,Bureau of Land Management,20180298,20180298
https://cdxnodengn.epa.gov/cdx-enepa-II/public/action/eis/details?eisId=263095,Upper Llagas Creek Flood Protection Project,Final,02/01/2019,12/07/2018,U.S. Army Corps of Engineers,CA,263095,Upper Llagas Creek Flood Protection Project,20180300,Final,2019-01-1100:00:00.0,"","","",,CA,U.S. Army Corps of Engineers,Keith D. Hess,707-443-0855,"",5,"",2018,2018,U.S. Army Corps of Engineers,20180300,20180300
https://cdxnodengn.epa.gov/cdx-enepa-II/public/action/eis/details?eisId=263310,DART Cotton Belt Corridor Regional Rail Project,Final,"",12/07/2018,Department of Transportation (other),TX,263310,DART Cotton Belt Corridor Regional Rail Project,20180305,Final,"",2018-12-1400:00:00.0,"Revision to FR Notice Published 12/07/2018; as required by Public Law 114-94 and 23 USC 139(n)(2) and 49 USC 304a(b), the FTA and the FAA have issued a combined FEIS and Record of Decision. Therefore, there will be no 30-day review period for the FEIS prior to the issuance of a Record of Decision.","",,TX,Federal Transit Administration,Melissa Foreman,817-978-0554,"",5,"",2018,2018,Department of Transportation (other),20180305,20180305
https://cdxnodengn.epa.gov/cdx-enepa-II/public/action/eis/details?eisId=263413,SR 710 North Study FEIR/FEIS,Final,02/01/2019,12/07/2018,California Department of Transportation,CA,263413,SR 710 North Study FEIR/FEIS,20180306,Final,2019-01-0700:00:00.0,"","","",,CA,California Department of Transportation,Jason Roach,213-897-0357,"",5,"",2018,2018,California Department of Transportation,20180306,20180306
https://cdxnodengn.epa.gov/cdx-enepa-II/public/action/eis/details?eisId=263872,Riley Ridge to Natrona,Final,01/31/2019,12/14/2018,Bureau of Land Management,WY,263872,Riley Ridge to Natrona,20180310,Final,2019-01-1400:00:00.0,"","","",,WY,Bureau of Land Management,Mark Makiewicz,435-636-3616,"",5,"",2018,2018,Bureau of Land Management,20180310,20180310
https://cdxnodengn.epa.gov/cdx-enepa-II/public/action/eis/details?eisId=264128,Big South Fork National River and Recreation Area Final Contaminated Mine Drainage Mitigation and Treatment Programmatic and Site Specific Environmental Impact Statement,Final,02/04/2019,12/21/2018,National Park Service,Multi,264128,Big South Fork National River and Recreation Area Final Contaminated Mine Drainage Mitigation and Treatment Programmatic and Site Specific Environmental Impact Statement,20180314,Final,2019-01-2200:00:00.0,"","","",,TN-KY,National Park Service,Michael Edwards,303-969-2694,"",5,"",2018,2018,National Park Service,20180314,20180314
https://cdxnodengn.epa.gov/cdx-enepa-II/public/action/eis/details?eisId=264190,Issuance of an Incidental Take Permit and Implementation of a Habitat Conservation Plan for the R-Project Transmission Line,Final,"",02/08/2019,Fish and Wildlife Service,NE,264190,Issuance of an Incidental Take Permit and Implementation of a Habitat Conservation Plan for the R-Project Transmission Line,20180315,Final,2019-03-1100:00:00.0,"","","",,NE,Fish and Wildlife Service,Drue DeBerry,303-236-4774,"",6,"",2018,2018,Fish and Wildlife Service,20180315,20180315
https://cdxnodengn.epa.gov/cdx-enepa-II/public/action/eis/details?eisId=264149,Amendment 11 to the 2006 Consolidated Atlantic Highly Migratory Species Fishery Management Plan,Final,"",12/21/2018,National Oceanic and Atmospheric Administration,NAT,264149,Amendment 11 to the 2006 Consolidated Atlantic Highly Migratory Species Fishery Management Plan,20180318,Final,2019-01-2200:00:00.0,"","","",,NAT,National Marine Fisheries Service,Guy DuBeck,301-427-8503,"",6,"",2018,2018,National Oceanic and Atmospheric Administration,20180318,20180318
https://cdxnodengn.epa.gov/cdx-enepa-II/public/action/eis/details?eisId=264407,Lost Creek Uranium In-Situ Recover Project Modifications,Final,02/26/2019,12/28/2018,Bureau of Land Management,WY,264407,Lost Creek Uranium In-Situ Recover Project Modifications,20180320,Final,2019-01-2800:00:00.0,"","","",,WY,Bureau of Land Management,Annette Treat,307-328-4314,"",5,"",2018,2018,Bureau of Land Management,20180320,20180320
https://cdxnodengn.epa.gov/cdx-enepa-II/public/action/eis/details?eisId=264417,Remediation of Area IV and the Northern Buffer Zone of the Santa Susana Field Laboratory,Final,02/04/2019,12/28/2018,Department of Energy,CA,264417,Remediation of Area IV and the Northern Buffer Zone of the Santa Susana Field Laboratory,20180321,Final,2019-01-2800:00:00.0,"","","",,CA,Department of Energy,Stephanie Jennings,805-842--3864,"",5,"",2018,2018,Department of Energy,20180321,20180321
https://cdxnodengn.epa.gov/cdx-enepa-II/public/action/eis/details?eisId=264761,Sunrise Vegetation and Fuels Management,Final,02/25/2019,02/01/2019,Forest Service,WA,264761,Sunrise Vegetation and Fuels Management,20180325,Final,2019-03-0400:00:00.0,"","","",,WA,Forest Service,Johnny Collin,509-843-4643,"",5,"",2018,2018,Forest Service,20180325,20180325
https://cdxnodengn.epa.gov/cdx-enepa-II/public/action/eis/details?eisId=265321,Driftwood LNG Project,Final,"",02/01/2019,Federal Energy Regulatory Commission,LA,265321,Driftwood LNG Project,20180331,Final,2019-03-0400:00:00.0,"","","",,LA,Federal Energy Regulatory Commission,Office of external Affairs,866-208-3372,"",6,"",2018,2018,Federal Energy Regulatory Commission,20180331,20180331
https://cdxnodengn.epa.gov/cdx-enepa-II/public/action/eis/details?eisId=265341,Yuba River Development Project,Final,02/28/2019,02/01/2019,Federal Energy Regulatory Commission,CA,265341,Yuba River Development Project,20180332,Final,2019-03-0400:00:00.0,"","","",,CA,Federal Energy Regulatory Commission,Alan Mitchnick,202-502-6074,"",5,"",2018,2018,Federal Energy Regulatory Commission,20180332,20180332
https://cdxnodengn.epa.gov/cdx-enepa-II/public/action/eis/details?eisId=265361,Swan Lake North Pumped Storage Project,Final,02/25/2019,02/01/2019,Federal Energy Regulatory Commission,OR,265361,Swan Lake North Pumped Storage Project,20180333,Final,2019-03-0400:00:00.0,"","","",,OR,Federal Energy Regulatory Commission,Office of External Affairs,866-208-3372,"",5,"",2018,2018,Federal Energy Regulatory Commission,20180333,20180333
https://cdxnodengn.epa.gov/cdx-enepa-II/public/action/eis/details?eisId=265369,Northeast Supply Enhancement Project,Final,"",02/01/2019,Federal Energy Regulatory Commission,NY,265369,Northeast Supply Enhancement Project,20180334,Final,2019-03-0400:00:00.0,"","","",,NY,Federal Energy Regulatory Commission,Office of External Affairs,866-208-3372,"",6,"",2018,2018,Federal Energy Regulatory Commission,20180334,20180334
https://cdxnodengn.epa.gov/cdx-enepa-II/public/action/eis/details?eisId=265701,Ohio Creek Watershed Project,Final,"",02/08/2019,Department of Housing and Urban Development,VA,265701,Ohio Creek Watershed Project,20190002,Final,2019-03-1100:00:00.0,"","","",,VA,Department of Housing and Urban Development,Kerry Johnson,804-822-4803,"",6,"",2019,2019,Department of Housing and Urban Development,20190002,20190002
https://cdxnodengn.epa.gov/cdx-enepa-II/public/action/eis/details?eisId=265729,"Port Arthur Liquefaction Project, Texas Connector Project, and Louisiana Connector Project",Final,"",02/08/2019,Federal Energy Regulatory Commission,Multi,265729,"Port Arthur Liquefaction Project, Texas Connector Project, and Louisiana Connector Project",20190003,Final,2019-03-1100:00:00.0,"","","",,LA-TX,Federal Energy Regulatory Commission,Office of External Affairs,866-208-3372,"",6,"",2019,2019,Federal Energy Regulatory Commission,20190003,20190003
https://cdxnodengn.epa.gov/cdx-enepa-II/public/action/eis/details?eisId=265801,"Final Environmental Impact Statement to Analyze Impacts of NOAAs National Marine Fisheries Service Proposed Approval of Hatchery and Genetic Management Plans for spring Chinook salmon, steelhead, and rainbow trout in the Upper Willamette River Basin Pursuant to Section 7 and 4(d) of the Endangered Species Act",Final,03/07/2019,02/08/2019,National Oceanic and Atmospheric Administration,OR,265801,"Final Environmental Impact Statement to Analyze Impacts of NOAAs National Marine Fisheries Service Proposed Approval of Hatchery and Genetic Management Plans for spring Chinook salmon, steelhead, and rainbow trout in the Upper Willamette River Basin Pursuant to Section 7 and 4(d) of the Endangered Species Act",20190004,Final,2019-03-1100:00:00.0,"","","",,OR,National Marine Fisheries Service,Lance Kruzic,541-957-3381,"",5,"",2019,2019,National Oceanic and Atmospheric Administration,20190004,20190004
https://cdxnodengn.epa.gov/cdx-enepa-II/public/action/eis/details?eisId=266043,Polar Security Cutter Acquisition Program Final Programmatic Environmental Impact Statement,Final,03/15/2019,02/15/2019,Department of Homeland Security,Multi,266043,Polar Security Cutter Acquisition Program Final Programmatic Environmental Impact Statement,20190007,Final,2019-03-1800:00:00.0,"","","",,AK-WA,U.S. Coast Guard,Christine Wiegand,202-475-3742,"",5,"",2019,2019,Department of Homeland Security,20190007,20190007
https://cdxnodengn.epa.gov/cdx-enepa-II/public/action/eis/details?eisId=266059,Bog Creek Road Project,Final,"",02/15/2019,Department of Homeland Security,ID,266059,Bog Creek Road Project,20190008,Final,2019-04-0200:00:00.0,"","","",,ID,U.S. Customs and Border Protection,Joseph Zidron,949-643-6392,"",6,"",2019,2019,Department of Homeland Security,20190008,20190008
https://cdxnodengn.epa.gov/cdx-enepa-II/public/action/eis/details?eisId=266163,Little Boulder,Final,03/28/2019,02/15/2019,Forest Service,ID,266163,Little Boulder,20190009,Final,2019-04-0100:00:00.0,"","","",,ID,Forest Service,Johanna Kovarik,208-476-8344,"",5,"",2019,2019,Forest Service,20190009,20190009
https://cdxnodengn.epa.gov/cdx-enepa-II/public/action/eis/details?eisId=266183,Crested Butte Mountain Resort Ski Area Projects,Final,03/27/2019,02/15/2019,Forest Service,CO,266183,Crested Butte Mountain Resort Ski Area Projects,20190010,Final,2019-04-0100:00:00.0,"","","",,CO,Forest Service,Aaron Drendel,970-641-0471,"",5,"",2019,2019,Forest Service,20190010,20190010
https://cdxnodengn.epa.gov/cdx-enepa-II/public/action/eis/details?eisId=266446,Otay Mesa Land Port of Entry Modernization and Expansion,Final,"",03/01/2019,General Services Administration,CA,266446,Otay Mesa Land Port of Entry Modernization and Expansion,20190017,Final,2019-04-0100:00:00.0,"","","",,CA,General Services Administration,Osmahn Kadri,415-522-3617,"",6,"",2019,2019,General Services Administration,20190017,20190017
https://cdxnodengn.epa.gov/cdx-enepa-II/public/action/eis/details?eisId=267280,San Juan Mine Deep Lease Extension Mining Plan Modification,Final,"",03/15/2019,Department of Interior (other),NM,267280,San Juan Mine Deep Lease Extension Mining Plan Modification,20190023,Final,2019-04-1500:00:00.0,"","","",,NM,Office of Surface Mining,Gretchen Pinkham,303-293-5088,"",6,"",2019,2019,Department of Interior (other),20190023,20190023
https://cdxnodengn.epa.gov/cdx-enepa-II/public/action/eis/details?eisId=267341,"Kachess Drought Relief Pumping Plant and Keechelus Reservoir-to-Kachess Reservoir Conveyance Projects Final Environmental Impact Statement, Kittitas and Yakima Counties, Washington",Final,"",03/15/2019,Bureau of Reclamation,WA,267341,"Kachess Drought Relief Pumping Plant and Keechelus Reservoir-to-Kachess Reservoir Conveyance Projects Final Environmental Impact Statement, Kittitas and Yakima Counties, Washington",20190024,Final,2019-04-1500:00:00.0,"","","",,WA,Bureau of Reclamation,Ms. Candace McKinley,509-573-8020,"",6,"",2019,2019,Bureau of Reclamation,20190024,20190024
https://cdxnodengn.epa.gov/cdx-enepa-II/public/action/eis/details?eisId=267404,U.S. Highway 85 - I-94 Interchange to Watford City Bypass,Final,"",03/15/2019,Federal Highway Administration,ND,267404,U.S. Highway 85 - I-94 Interchange to Watford City Bypass,20190026,Final,"","","","
					Under 23 U.S.C. 139(n)(2), FHWA has issued a single document that consists of a final environmental impact statement and record of decision. Therefore, the 30-day wait/review period under NEPA does not apply to this action.",,ND,Federal Highway Administration,Kevin Brodie,701-221-9467,"",6,"",2019,2019,Federal Highway Administration,20190026,20190026
https://cdxnodengn.epa.gov/cdx-enepa-II/public/action/eis/details?eisId=267441,"South Farallon Islands Invasive House Mouse Eradication Project; Farallon Islands National Wildlife Refuge, California",Final,04/15/2019,03/15/2019,Fish and Wildlife Service,CA,267441,"South Farallon Islands Invasive House Mouse Eradication Project; Farallon Islands National Wildlife Refuge, California",20190027,Final,2019-04-1500:00:00.0,"","","",,CA,Fish and Wildlife Service,Gerry McChesney,"510-792-0222, ext. 222","",5,"",2019,2019,Fish and Wildlife Service,20190027,20190027
https://cdxnodengn.epa.gov/cdx-enepa-II/public/action/eis/details?eisId=267471,Boise & Sawtooth Forest-wide Invasive Plant Species Treatments,Final,"",03/15/2019,Forest Service,ID,267471,Boise & Sawtooth Forest-wide Invasive Plant Species Treatments,20190028,Final,2019-04-2900:00:00.0,"","","",,ID,Forest Service,Michael Haney,208-423-7530,"",6,"",2019,2019,Forest Service,20190028,20190028
https://cdxnodengn.epa.gov/cdx-enepa-II/public/action/eis/details?eisId=267681,Sonoran Valley Parkway Project,Final,04/22/2019,03/22/2019,Bureau of Land Management,AZ,267681,Sonoran Valley Parkway Project,20190033,Final,2019-04-2200:00:00.0,"","","",,AZ,Bureau of Land Management,Ben Parsons,623-580-5681,"",5,"",2019,2019,Bureau of Land Management,20190033,20190033
https://cdxnodengn.epa.gov/cdx-enepa-II/public/action/eis/details?eisId=267820,Texas LNG Project-Texas LNG Brownsville LLC,Final,"",03/22/2019,Federal Energy Regulatory Commission,TX,267820,Texas LNG Project-Texas LNG Brownsville LLC,20190034,Final,2019-04-2200:00:00.0,"","","",,TX,Federal Energy Regulatory Commission,Office of External Affairs,866-208-3372,"",6,"",2019,2019,Federal Energy Regulatory Commission,20190034,20190034
https://cdxnodengn.epa.gov/cdx-enepa-II/public/action/eis/details?eisId=267961,"I-4400/I-4700 I-26 Widening Combined Final Environmental Impact Statement, Final Section 4(f) Evaluation, and Record of Decision",Final,04/12/2019,03/29/2019,Federal Highway Administration,NC,267961,"I-4400/I-4700 I-26 Widening Combined Final Environmental Impact Statement, Final Section 4(f) Evaluation, and Record of Decision",20190037,Final,"","","","
					Under 23 U.S.C. 139(n)(2), FHWA has issued a single document that consists of a final environmental impact statement and record of decision. Therefore, the 30-day wait/review period under NEPA does not apply to this action.",,NC,Federal Highway Administration,"Clarence W. Coleman, PE",919-747-7014,"",5,"",2019,2019,Federal Highway Administration,20190037,20190037
https://cdxnodengn.epa.gov/cdx-enepa-II/public/action/eis/details?eisId=268155,Lolo Insect & Disease Project,Final,04/22/2019,03/29/2019,Forest Service,ID,268155,Lolo Insect & Disease Project,20190039,Final,2019-04-2900:00:00.0,"","","",,ID,Forest Service,Sara Daugherty,208-926-6404,"",5,"",2019,2019,Forest Service,20190039,20190039
https://cdxnodengn.epa.gov/cdx-enepa-II/public/action/eis/details?eisId=268201,Acadia National Park Final Transportation Plan and EIS,Final,04/29/2019,03/29/2019,National Park Service,ME,268201,Acadia National Park Final Transportation Plan and EIS,20190040,Final,2019-04-2900:00:00.0,"","","",,ME,National Park Service,John Kelly,207-288-8703,"",5,"",2019,2019,National Park Service,20190040,20190040
https://cdxnodengn.epa.gov/cdx-enepa-II/public/action/eis/details?eisId=268557,Copper Flat Copper Mine,Final,"",04/19/2019,Bureau of Land Management,NM,268557,Copper Flat Copper Mine,20190044,Final,2019-05-2000:00:00.0,"","","",,NM,Bureau of Land Management,Leighandra Keeven,575-525-4337,"",6,"",2019,2019,Bureau of Land Management,20190044,20190044
https://cdxnodengn.epa.gov/cdx-enepa-II/public/action/eis/details?eisId=269549,Environmental Impact Statement for an Early Site Permit at the Clinch River Nuclear Site,Final,04/23/2019,04/12/2019,Nuclear Regulatory Commission,TN,269549,Environmental Impact Statement for an Early Site Permit at the Clinch River Nuclear Site,20190052,Final,2019-05-1300:00:00.0,"","","",,TN,Nuclear Regulatory Commission,Tamsen Dozier,301-415-2272,"",5,"",2019,2019,Nuclear Regulatory Commission,20190052,20190052
https://cdxnodengn.epa.gov/cdx-enepa-II/public/action/eis/details?eisId=269821,Medicine Bow Landscape Vegetation Analysis (LaVA) Project,Final,05/16/2019,04/19/2019,Forest Service,WY,269821,Medicine Bow Landscape Vegetation Analysis (LaVA) Project,20190057,Final,2019-05-2000:00:00.0,"","","",,WY,Forest Service,Melissa Martin,307-745-2371,"",5,"",2019,2019,Forest Service,20190057,20190057
https://cdxnodengn.epa.gov/cdx-enepa-II/public/action/eis/details?eisId=269871,Hunts Point Interstate Access Improvement Project,Final,"",04/19/2019,Federal Highway Administration,NY,269871,Hunts Point Interstate Access Improvement Project,20190058,Final,"","","","
					Under 23 U.S.C. 139(n)(2), FHWA has issued a single document that consists of a final environmental impact statement and record of decision. Therefore, the 30-day wait/review period under NEPA does not apply to this action.",,NY,Federal Highway Administration,Erik Koester- NYSDOT Project Director,718-482-4683,"",6,"",2019,2019,Federal Highway Administration,20190058,20190058
https://cdxnodengn.epa.gov/cdx-enepa-II/public/action/eis/details?eisId=270081,"Eagle LNG Partners Jacksonville, LLC Jacksonville Project",Final,04/23/2019,04/19/2019,Federal Energy Regulatory Commission,FL,270081,"Eagle LNG Partners Jacksonville, LLC Jacksonville Project",20190062,Final,2019-05-2000:00:00.0,"","","",,FL,Federal Energy Regulatory Commission,Office of External Affairs,866-208-3372,"",5,"",2019,2019,Federal Energy Regulatory Commission,20190062,20190062
https://cdxnodengn.epa.gov/cdx-enepa-II/public/action/eis/details?eisId=270488,Gulf LNG Liquefaction Project,Final,05/20/2019,04/26/2019,Federal Energy Regulatory Commission,MS,270488,Gulf LNG Liquefaction Project,20190065,Final,2019-05-2800:00:00.0,"","","",,MS,Federal Energy Regulatory Commission,Office of External Affairs,866-208-3372,"",5,"",2019,2019,Federal Energy Regulatory Commission,20190065,20190065
https://cdxnodengn.epa.gov/cdx-enepa-II/public/action/eis/details?eisId=270550,San Pedro Riparian National Conservation Area Proposed Resource Management Plan,Final,05/24/2019,04/26/2019,Bureau of Land Management,AZ,270550,San Pedro Riparian National Conservation Area Proposed Resource Management Plan,20190066,Final,2019-05-2800:00:00.0,"","","",,AZ,Bureau of Land Management,Amy McGowan,520-258-7231,"",5,"",2019,2019,Bureau of Land Management,20190066,20190066
https://cdxnodengn.epa.gov/cdx-enepa-II/public/action/eis/details?eisId=270641,Annova LNG Brownsville Project,Final,"",04/26/2019,Federal Energy Regulatory Commission,TX,270641,Annova LNG Brownsville Project,20190069,Final,2019-05-2800:00:00.0,"","","",,TX,Federal Energy Regulatory Commission,Office of External Affairs,866-208-3372,"",6,"",2019,2019,Federal Energy Regulatory Commission,20190069,20190069
https://cdxnodengn.epa.gov/cdx-enepa-II/public/action/eis/details?eisId=270664,Crow Creek Pipeline Project,Final,05/24/2019,04/26/2019,Forest Service,Multi,270664,Crow Creek Pipeline Project,20190070,Final,2019-05-2800:00:00.0,"","","",,ID-WY,Forest Service,Doug Herzog,208-557-5763,"",5,"",2019,2019,Forest Service,20190070,20190070
https://cdxnodengn.epa.gov/cdx-enepa-II/public/action/eis/details?eisId=270821,Tonto National Forest Motorized Travel Management,Final,"",05/03/2019,Forest Service,AZ,270821,Tonto National Forest Motorized Travel Management,20190073,Final,2019-06-0300:00:00.0,"","","
					Due to an administrative error by the USFS, the Final EIS was not properly filed with the U.S. Environmental Protection Agency. USFS has confirmed that distribution of the Final EIS was made available to all federal agencies and interested parties for the 30-day wait period that will end on 06/03/2019.",,AZ,Forest Service,Gregory Schuster,602-225-5362,"",5,"",2019,2019,Forest Service,20190073,20190073
