eis_url,Title,Document,EPA.Comment.Letter.Date,Federal.Register.Date,Agency,State,EIS_ID,EIS.Title,EIS.Number,Document.Type,EIS.Comment.Due..Review.Period.Date,Amended.Notice.Date,Amended.Notice,Supplemental.Information,Website,State.or.Territory,Lead.Agency,Contact.Name,Contact.Phone,Rating..if.Draft.EIS.,na_by_row,Issuance.of.Notice.of.Intent.to.Prepare.an.EIS.,Year,YEAR,AGENCY,PROJECT_ID,MASTER_ID
https://cdxnodengn.epa.gov/cdx-enepa-II/public/action/eis/details?eisId=210732,Dominguez-Escalante National Conservation Area Proposed Resource Management Plan,Final,"",07/01/2016,Bureau of Land Management,CO,210732,Dominguez-Escalante National Conservation Area Proposed Resource Management Plan,20160144,Final,2016-08-0100:00:00.0,"","","",,CO,Bureau of Land Management,Collin Ewing,970-244-3049,"",6,"",2016,2016,Bureau of Land Management,20160144,20160144
https://cdxnodengn.epa.gov/cdx-enepa-II/public/action/eis/details?eisId=210841,Tongass Land and Resource Management Plan Amendment,Final,08/01/2016,07/01/2016,Forest Service,AK,210841,Tongass Land and Resource Management Plan Amendment,20160146,Final,2016-08-0100:00:00.0,"","","",,AK,Forest Service,Susan Howle,907-225-3101,"",5,"",2016,2016,Forest Service,20160146,20160146
https://cdxnodengn.epa.gov/cdx-enepa-II/public/action/eis/details?eisId=210850,Kake to Petersburg Transmission Line Intertie Project,Final,07/27/2016,07/01/2016,Forest Service,AK,210850,Kake to Petersburg Transmission Line Intertie Project,20160147,Final,2016-08-0100:00:00.0,"","","",,AK,Forest Service,Tom Parker,907-772-5974,"",5,"",2016,2016,Forest Service,20160147,20160147
https://cdxnodengn.epa.gov/cdx-enepa-II/public/action/eis/details?eisId=210861,Figure Eight Island Shoreline Management Project,Final,08/08/2016,07/08/2016,U.S. Army Corps of Engineers,NC,210861,Figure Eight Island Shoreline Management Project,20160148,Final,2016-08-0800:00:00.0,"","","",,NC,U.S. Army Corps of Engineers,Mickey Sugg,910-251-4811,"",5,"",2016,2016,U.S. Army Corps of Engineers,20160148,20160148
https://cdxnodengn.epa.gov/cdx-enepa-II/public/action/eis/details?eisId=210995,Seminole Tribe of Florida Fee to Trust,Final,07/26/2016,07/08/2016,Bureau of Indian Affairs,FL,210995,Seminole Tribe of Florida Fee to Trust,20160149,Final,2016-08-0800:00:00.0,"","","",,FL,Bureau of Indian Affairs,Chester McGhee,615-564-6830,"",5,"",2016,2016,Bureau of Indian Affairs,20160149,20160149
https://cdxnodengn.epa.gov/cdx-enepa-II/public/action/eis/details?eisId=211187,Bull Mountain Unit Master Development Plan,Final,08/08/2016,07/08/2016,Bureau of Land Management,CO,211187,Bull Mountain Unit Master Development Plan,20160151,Final,2016-08-0800:00:00.0,"","","",,CO,Bureau of Land Management,Gina Jones,970-240-5300,"",5,"",2016,2016,Bureau of Land Management,20160151,20160151
https://cdxnodengn.epa.gov/cdx-enepa-II/public/action/eis/details?eisId=211301,High Desert Corridor,Final,08/15/2016,07/15/2016,California Department of Transportation,CA,211301,High Desert Corridor,20160153,Final,2016-08-1500:00:00.0,"","","",,CA,California Department of Transportation,Ron Kosinski,213-897-0703,"",5,"",2016,2016,California Department of Transportation,20160153,20160153
https://cdxnodengn.epa.gov/cdx-enepa-II/public/action/eis/details?eisId=210421,Herring River Restoration Project,Final,08/08/2016,07/15/2016,National Park Service,MA,210421,Herring River Restoration Project,20160154,Final,2016-08-1500:00:00.0,"","","",,MA,National Park Service,Mark Husbands,303-987-6965,"",5,"",2016,2016,National Park Service,20160154,20160154
https://cdxnodengn.epa.gov/cdx-enepa-II/public/action/eis/details?eisId=211361,Bottineau Light Rail Transit Metro Blue Line Extension FEIS,Final,08/12/2016,07/15/2016,Department of Transportation (other),MN,211361,Bottineau Light Rail Transit Metro Blue Line Extension FEIS,20160155,Final,2016-08-1500:00:00.0,"","","",,MN,Federal Transit Administration,Maya Sarna,202-366-5811,"",5,"",2016,2016,Department of Transportation (other),20160155,20160155
https://cdxnodengn.epa.gov/cdx-enepa-II/public/action/eis/details?eisId=211444,Land-Water Interface and Service Pier Extension at Naval Base Kitsap Bangor,Final,08/11/2016,07/15/2016,Department of Defense,WA,211444,Land-Water Interface and Service Pier Extension at Naval Base Kitsap Bangor,20160157,Final,2016-08-1500:00:00.0,"","","",,WA,United States Navy,Robin Senner,360-396-0029,"",5,"",2016,2016,Department of Defense,20160157,20160157
https://cdxnodengn.epa.gov/cdx-enepa-II/public/action/eis/details?eisId=211561,Mendota Pool Bypass and Reach 2B Improvements Project,Final,08/11/2016,07/15/2016,Bureau of Reclamation,CA,211561,Mendota Pool Bypass and Reach 2B Improvements Project,20160160,Final,2016-08-1500:00:00.0,"","","",,CA,Bureau of Reclamation,Becky Victorine,916-978-4624,"",5,"",2016,2016,Bureau of Reclamation,20160160,20160160
https://cdxnodengn.epa.gov/cdx-enepa-II/public/action/eis/details?eisId=211575,Puget Sound Nearshore Ecosystem Restoration,Final,08/10/2016,07/15/2016,U.S. Army Corps of Engineers,WA,211575,Puget Sound Nearshore Ecosystem Restoration,20160161,Final,2016-08-1500:00:00.0,"","","",,WA,U.S. Army Corps of Engineers,Nancy C. Gleason,206-764-6577,"",5,"",2016,2016,U.S. Army Corps of Engineers,20160161,20160161
https://cdxnodengn.epa.gov/cdx-enepa-II/public/action/eis/details?eisId=211637,Telegraph Vegetation Project,Final,"",07/15/2016,Forest Service,MT,211637,Telegraph Vegetation Project,20160162,Final,2016-08-1500:00:00.0,"","","",,MT,Forest Service,Sharon Scott,406-495-3943,"",6,"",2016,2016,Forest Service,20160162,20160162
https://cdxnodengn.epa.gov/cdx-enepa-II/public/action/eis/details?eisId=211864,Na Pua Makani Wind Project and Habitat Conservation Plan,Final,08/19/2016,07/22/2016,Fish and Wildlife Service,HI,211864,Na Pua Makani Wind Project and Habitat Conservation Plan,20160165,Final,2016-08-2200:00:00.0,"","","",,HI,Fish and Wildlife Service,Ms Jodi Charrier,808-792-9400,"",5,"",2016,2016,Fish and Wildlife Service,20160165,20160165
https://cdxnodengn.epa.gov/cdx-enepa-II/public/action/eis/details?eisId=211901,Lower Joseph Creek Restoration Project,Final,"",07/22/2016,Forest Service,OR,211901,Lower Joseph Creek Restoration Project,20160166,Final,2016-08-2300:00:00.0,"","","",,OR,Forest Service,Anne Thomas,541-278-3860,"",6,"",2016,2016,Forest Service,20160166,20160166
https://cdxnodengn.epa.gov/cdx-enepa-II/public/action/eis/details?eisId=211997,The Pokagon Band of Potawatomi Indians Fee-to-Trust Transfer for Tribal Village and Casino,Final,08/22/2016,07/22/2016,Bureau of Indian Affairs,IN,211997,The Pokagon Band of Potawatomi Indians Fee-to-Trust Transfer for Tribal Village and Casino,20160170,Final,2016-08-2200:00:00.0,"","","",,IN,Bureau of Indian Affairs,Scott Doig,612-725-4514,"",5,"",2016,2016,Bureau of Indian Affairs,20160170,20160170
https://cdxnodengn.epa.gov/cdx-enepa-II/public/action/eis/details?eisId=212062,Moab Master Leasing Plan and Proposed Resource Management Plan Amendments,Final,"",07/22/2016,Bureau of Land Management,UT,212062,Moab Master Leasing Plan and Proposed Resource Management Plan Amendments,20160171,Final,2016-08-2200:00:00.0,"","","",,UT,Bureau of Land Management,Brent Northrup,435-259-2151,"",6,"",2016,2016,Bureau of Land Management,20160171,20160171
https://cdxnodengn.epa.gov/cdx-enepa-II/public/action/eis/details?eisId=212439,Eastern Interior Proposed Resource Management Plan,Final,08/11/2016,07/29/2016,Bureau of Land Management,AK,212439,Eastern Interior Proposed Resource Management Plan,20160173,Final,2016-08-2900:00:00.0,"","","",,AK,Bureau of Land Management,Jeanie Cole,907-474-2340,"",5,"",2016,2016,Bureau of Land Management,20160173,20160173
https://cdxnodengn.epa.gov/cdx-enepa-II/public/action/eis/details?eisId=212774,Previously Issued Oil and Gas Leases in the White River National Forest,Final,"",08/05/2016,Bureau of Land Management,CO,212774,Previously Issued Oil and Gas Leases in the White River National Forest,20160178,Final,2016-09-0600:00:00.0,"","","",,CO,Bureau of Land Management,Gregory Larson,970-876-9000,"",6,"",2016,2016,Bureau of Land Management,20160178,20160178
https://cdxnodengn.epa.gov/cdx-enepa-II/public/action/eis/details?eisId=212807,"Lower Yaak, OBrien, Sheep Project",Final,08/30/2016,08/05/2016,Forest Service,MT,212807,"Lower Yaak, OBrien, Sheep Project",20160179,Final,2016-09-0600:00:00.0,"","","",,MT,Forest Service,Miles Friend,406-295-4693,"",5,"",2016,2016,Forest Service,20160179,20160179
https://cdxnodengn.epa.gov/cdx-enepa-II/public/action/eis/details?eisId=212821,Golden Pass LNG Export Project,Final,09/09/2016,08/05/2016,Federal Energy Regulatory Commission,Multi,212821,Golden Pass LNG Export Project,20160180,Final,2016-09-0600:00:00.0,"","","",,LA-TX,Federal Energy Regulatory Commission,Eric Howard,202-502-6263,"",5,"",2016,2016,Federal Energy Regulatory Commission,20160180,20160180
https://cdxnodengn.epa.gov/cdx-enepa-II/public/action/eis/details?eisId=212837,"Rover Pipeline, Panhandle Backhaul, and Trunkline Backhaul Projects",Final,09/01/2016,08/05/2016,Federal Energy Regulatory Commission,Multi,212837,"Rover Pipeline, Panhandle Backhaul, and Trunkline Backhaul Projects",20160181,Final,2016-09-0600:00:00.0,"","","",,OH-IL-IN-MI-MS-PA-TN-WV,Federal Energy Regulatory Commission,Kevin Bowman,202-502-6287,"",5,"",2016,2016,Federal Energy Regulatory Commission,20160181,20160181
https://cdxnodengn.epa.gov/cdx-enepa-II/public/action/eis/details?eisId=212944,West of Devers Upgrade Proect,Final,09/06/2016,08/05/2016,Bureau of Land Management,CA,212944,West of Devers Upgrade Proect,20160182,Final,2016-09-0600:00:00.0,"","","",,CA,Bureau of Land Management,Frank McMenimen,760-833-7150,"",5,"",2016,2016,Bureau of Land Management,20160182,20160182
https://cdxnodengn.epa.gov/cdx-enepa-II/public/action/eis/details?eisId=213201,Arapahoe Basin Ski Area Projects,Final,"",08/12/2016,Forest Service,CO,213201,Arapahoe Basin Ski Area Projects,20160183,Final,2016-09-1900:00:00.0,"","","",,CO,Forest Service,Matthew Ehrman,970-945-3212,"",6,"",2016,2016,Forest Service,20160183,20160183
https://cdxnodengn.epa.gov/cdx-enepa-II/public/action/eis/details?eisId=213581,National Wildlife Refuge System Revision of Regulations Governing Non-Federal Oil and Gas Rights,Final,"",08/19/2016,Fish and Wildlife Service,NAT,213581,National Wildlife Refuge System Revision of Regulations Governing Non-Federal Oil and Gas Rights,20160186,Final,2016-09-1900:00:00.0,"","","",,NAT,Fish and Wildlife Service,Scott Covington,703-358-2427,"",6,"",2016,2016,Fish and Wildlife Service,20160186,20160186
https://cdxnodengn.epa.gov/cdx-enepa-II/public/action/eis/details?eisId=213903,Phase 2 Fuel Efficiency Standards for Medium- and Heavy-Duty Engines and Vehicles,Final,"",08/26/2016,Department of Transportation (other),NAT,213903,Phase 2 Fuel Efficiency Standards for Medium- and Heavy-Duty Engines and Vehicles,20160188,Final,"",2016-09-0200:00:00.0,Revision to FR Notice Published 08/26/2016; Change Review Period to No Review Period,"
					Under 49 U.S.C. 304a(b), NHTSA has issued a Final EIS and ROD. Therefore, the 30-day wait/review period under NEPA does not apply to this action",,NAT,National Highway Traffic Safety Administration,James Tamm,202-493-0515,"",4,"",2016,2016,Department of Transportation (other),20160188,20160188
https://cdxnodengn.epa.gov/cdx-enepa-II/public/action/eis/details?eisId=213681,Sheep Mountain Uranium Project,Final,"",08/26/2016,Bureau of Land Management,WY,213681,Sheep Mountain Uranium Project,20160189,Final,2016-09-2600:00:00.0,"","","",,WY,Bureau of Land Management,Tom Sunderland,307-332-8400,"",6,"",2016,2016,Bureau of Land Management,20160189,20160189
https://cdxnodengn.epa.gov/cdx-enepa-II/public/action/eis/details?eisId=216501,Angoon Airport Project,Final,09/14/2016,09/02/2016,Department of Transportation (other),AK,216501,Angoon Airport Project,20160194,Final,2016-10-0300:00:00.0,"","","",,AK,Federal Aviation Administration,Leslie Grey,907-271-5453,"",5,"",2016,2016,Department of Transportation (other),20160194,20160194
https://cdxnodengn.epa.gov/cdx-enepa-II/public/action/eis/details?eisId=216637,Revision of 9B Regulations Governing Non-Federal Oil and Gas Activities,Final,"",09/02/2016,National Park Service,Multi,216637,Revision of 9B Regulations Governing Non-Federal Oil and Gas Activities,20160196,Final,2016-10-0300:00:00.0,"","","",,AL-CA-CO-FL-PRO-IN-KS-KY-LA-MS-MT-ND-NM-OH-OK-PA-TN-TX-UT-VA-WV-WY,National Park Service,Michael B. Edwards,303-969-2694,"",6,"",2016,2016,National Park Service,20160196,20160196
https://cdxnodengn.epa.gov/cdx-enepa-II/public/action/eis/details?eisId=216785,Programmatic - Restoration Resulting from the Kalamazoo River Natural Resource Damage Assessment,Final,10/03/2016,09/02/2016,National Oceanic and Atmospheric Administration,MI,216785,Programmatic - Restoration Resulting from the Kalamazoo River Natural Resource Damage Assessment,20160198,Final,2016-10-0300:00:00.0,"","","
					The U.S. Department of the Interior's Fish and Wildlife Service and the U.S. Department of Commerce's National Oceanic and Atmospheric Administration are joint lead agencies for the above project.",,MI,National Oceanic and Atmospheric Administration,Lisa Williams,517-351-8324,"",4,"",2016,2016,National Oceanic and Atmospheric Administration,20160198,20160198
https://cdxnodengn.epa.gov/cdx-enepa-II/public/action/eis/details?eisId=216857,Proposed Resource Management Plans for the Beaver Dam Wash and Red Cliffs National Conservation Areas; Proposed Amendment to the St. George Field Office Resource Management Plan,Final,10/03/2016,09/02/2016,Bureau of Land Management,UT,216857,Proposed Resource Management Plans for the Beaver Dam Wash and Red Cliffs National Conservation Areas; Proposed Amendment to the St. George Field Office Resource Management Plan,20160199,Final,2016-10-0300:00:00.0,"","","",,UT,Bureau of Land Management,Keith Rigtrup,435-865-3063,"",5,"",2016,2016,Bureau of Land Management,20160199,20160199
https://cdxnodengn.epa.gov/cdx-enepa-II/public/action/eis/details?eisId=217122,Moose-Wilson Corridor Final Comprehensive Management Plan,Final,10/05/2016,09/09/2016,National Park Service,WY,217122,Moose-Wilson Corridor Final Comprehensive Management Plan,20160202,Final,2016-10-1100:00:00.0,"","","",,WY,National Park Service,Daniel Noon,307-739-3465,"",5,"",2016,2016,National Park Service,20160202,20160202
https://cdxnodengn.epa.gov/cdx-enepa-II/public/action/eis/details?eisId=217181,Leach XPress and Rayne XPress Expansion Projects,Final,10/11/2016,09/09/2016,Federal Energy Regulatory Commission,Multi,217181,Leach XPress and Rayne XPress Expansion Projects,20160203,Final,2016-10-1100:00:00.0,"","","",,KY-PA-OH-WV,Federal Energy Regulatory Commission,Juan Polit,202-502-8652,"",5,"",2016,2016,Federal Energy Regulatory Commission,20160203,20160203
https://cdxnodengn.epa.gov/cdx-enepa-II/public/action/eis/details?eisId=216981,Rasmussen Valley Mine,Final,10/11/2016,09/09/2016,Bureau of Land Management,ID,216981,Rasmussen Valley Mine,20160204,Final,2016-10-1100:00:00.0,"","","",,ID,Bureau of Land Management,Bill Volk,208-236-7503,"",5,"",2016,2016,Bureau of Land Management,20160204,20160204
https://cdxnodengn.epa.gov/cdx-enepa-II/public/action/eis/details?eisId=217364,Los Padres Tamarisk Removal,Final,"",09/16/2016,Forest Service,CA,217364,Los Padres Tamarisk Removal,20160206,Final,2016-10-2600:00:00.0,"","","",,CA,Forest Service,Kyle Kinports,805-961-5710,"",6,"",2016,2016,Forest Service,20160206,20160206
https://cdxnodengn.epa.gov/cdx-enepa-II/public/action/eis/details?eisId=217403,South Shore of Staten Island Coastal Storm Risk Management Final Environmental Impact Statement,Final,10/17/2016,09/16/2016,U.S. Army Corps of Engineers,NY,217403,South Shore of Staten Island Coastal Storm Risk Management Final Environmental Impact Statement,20160207,Final,2016-10-1700:00:00.0,"","","",,NY,U.S. Army Corps of Engineers,Catherine J. Alcoba,917-790-8216,"",5,"",2016,2016,U.S. Army Corps of Engineers,20160207,20160207
https://cdxnodengn.epa.gov/cdx-enepa-II/public/action/eis/details?eisId=217628,Lassen National Forest Over-Snow Vehicle(OSV) Use Designation,Final,"",09/16/2016,Forest Service,CA,217628,Lassen National Forest Over-Snow Vehicle(OSV) Use Designation,20160210,Final,2016-10-1700:00:00.0,"","","",,CA,Forest Service,Chris Obrien,530-252-6698,"",6,"",2016,2016,Forest Service,20160210,20160210
https://cdxnodengn.epa.gov/cdx-enepa-II/public/action/eis/details?eisId=217681,"Divert Activities and Exercises, Commonwealth of the Northern Mariana Islands",Final,10/24/2016,09/26/2016,Department of Defense,GU,217681,"Divert Activities and Exercises, Commonwealth of the Northern Mariana Islands",20160211,Final,2016-10-2500:00:00.0,2016-09-3000:00:00.0,Revision to FR Notice Published 09/26/2016; Correction to the Review Period to End 10/25/2016,"",,GU,United States Air Force,Mark Petersen,(808) 449 1078,"",3,"",2016,2016,Department of Defense,20160211,20160211
https://cdxnodengn.epa.gov/cdx-enepa-II/public/action/eis/details?eisId=217741,Forestwide Site-Specific Invasive Plant Management,Final,"",09/30/2016,Forest Service,WA,217741,Forestwide Site-Specific Invasive Plant Management,20160213,Final,2016-10-3100:00:00.0,"","","",,WA,Forest Service,Brigitte Ranne,509-682-4941,"",6,"",2016,2016,Forest Service,20160213,20160213
https://cdxnodengn.epa.gov/cdx-enepa-II/public/action/eis/details?eisId=217801,Lambert Houses Redevelopment,Final,10/31/2016,09/30/2016,Department of Housing and Urban Development,NY,217801,Lambert Houses Redevelopment,20160216,Final,2016-10-3100:00:00.0,"","","
					City of New York Department of Housing Preservation and Development is lead agency for this project.",,NY,Department of Housing and Urban Development,Aaron Werner,212-863-5953,"",4,"",2016,2016,Department of Housing and Urban Development,20160216,20160216
https://cdxnodengn.epa.gov/cdx-enepa-II/public/action/eis/details?eisId=217927,"Generic - License Renewal of Nuclear Plants Supplement 56 Regarding Fermi 2 Nuclear Power Plant, NUREG-1437",Final,10/27/2016,09/30/2016,Nuclear Regulatory Commission,MI,217927,"Generic - License Renewal of Nuclear Plants Supplement 56 Regarding Fermi 2 Nuclear Power Plant, NUREG-1437",20160219,Final,2016-10-3100:00:00.0,"","","",,MI,Nuclear Regulatory Commission,Elaine M. Keegan,301-415-8517,"",5,"",2016,2016,Nuclear Regulatory Commission,20160219,20160219
https://cdxnodengn.epa.gov/cdx-enepa-II/public/action/eis/details?eisId=218219,Continued Implementation of the 2008 Operating Agreement for the Rio Grande Project,Final,11/03/2016,10/07/2016,Bureau of Reclamation,Multi,218219,Continued Implementation of the 2008 Operating Agreement for the Rio Grande Project,20160225,Final,2016-11-0700:00:00.0,"","","",,NM-TX,Bureau of Reclamation,Hector Garcia,505-462-3550,"",5,"",2016,2016,Bureau of Reclamation,20160225,20160225
https://cdxnodengn.epa.gov/cdx-enepa-II/public/action/eis/details?eisId=218303,Recapitalization of Infrastructure Supporting Naval Spent Nuclear Fuel Handling at the Idaho National Laboratory,Final,11/07/2016,10/07/2016,Department of Energy,ID,218303,Recapitalization of Infrastructure Supporting Naval Spent Nuclear Fuel Handling at the Idaho National Laboratory,20160229,Final,2016-11-0700:00:00.0,"","","",,ID,Department of Energy,Erik Anderson,202-781-6057,"",5,"",2016,2016,Department of Energy,20160229,20160229
https://cdxnodengn.epa.gov/cdx-enepa-II/public/action/eis/details?eisId=218701,Long-Term Experimental and Management Plan (LTEMP) for the Operation of Glen Canyon Dam,Final,11/14/2016,10/14/2016,Bureau of Reclamation,Multi,218701,Long-Term Experimental and Management Plan (LTEMP) for the Operation of Glen Canyon Dam,20160232,Final,2016-11-1400:00:00.0,"","","
					The U.S. Department of the Interior's Bureau of Reclamation and the Department of the Interior's National Park Service are joint lead agencies for the above project.",,AZ-CA-CO-NM-NV-UT-WY,Bureau of Reclamation,Katrina Grantz,801-524-3635,"",4,"",2016,2016,Bureau of Reclamation,20160232,20160232
https://cdxnodengn.epa.gov/cdx-enepa-II/public/action/eis/details?eisId=218776,Santa Margarita River Conjunctive Use Project,Final,11/14/2016,10/14/2016,Department of Defense,CA,218776,Santa Margarita River Conjunctive Use Project,20160233,Final,2016-11-1400:00:00.0,"","","
					The U.S.Marine Corps and the U.S. Department of the Interior's Bureau of Reclamation are joint lead agencies of the above project.",,CA,United States Marine Corps,Kristin Thomas,760-725-9741,"",4,"",2016,2016,Department of Defense,20160233,20160233
https://cdxnodengn.epa.gov/cdx-enepa-II/public/action/eis/details?eisId=219023,Amendment 18 to the Northeast Multispecies Fishery Management Plan,Final,11/14/2016,10/14/2016,National Oceanic and Atmospheric Administration,Multi,219023,Amendment 18 to the Northeast Multispecies Fishery Management Plan,20160235,Final,2016-11-1400:00:00.0,"","","",,MA-CT-DE-ME-NH-NJ-NY-RI,National Marine Fisheries Service,John Bullard,978-281-9343,"",5,"",2016,2016,National Oceanic and Atmospheric Administration,20160235,20160235
https://cdxnodengn.epa.gov/cdx-enepa-II/public/action/eis/details?eisId=219146,Beasley Pond Analysis Area,Final,11/29/2016,10/21/2016,Forest Service,FL,219146,Beasley Pond Analysis Area,20160237,Final,2016-12-0500:00:00.0,"","","",,FL,Forest Service,Branden Tolver,850-926-3561,"",5,"",2016,2016,Forest Service,20160237,20160237
https://cdxnodengn.epa.gov/cdx-enepa-II/public/action/eis/details?eisId=218676,Fire Island National Seashore General Management Plan,Final,11/18/2016,10/21/2016,National Park Service,NY,218676,Fire Island National Seashore General Management Plan,20160238,Final,2016-11-2100:00:00.0,"","","",,NY,National Park Service,Kaetlyn Jackson,631-687-4770,"",5,"",2016,2016,National Park Service,20160238,20160238
https://cdxnodengn.epa.gov/cdx-enepa-II/public/action/eis/details?eisId=219211,Vantage to Pomona Heights 230kV Transmission Line Project,Final,11/21/2016,10/21/2016,Bureau of Land Management,WA,219211,Vantage to Pomona Heights 230kV Transmission Line Project,20160241,Final,2016-11-2100:00:00.0,"","","",,WA,Bureau of Land Management,Robin Estes,541-416-6728,"",5,"",2016,2016,Bureau of Land Management,20160241,20160241
https://cdxnodengn.epa.gov/cdx-enepa-II/public/action/eis/details?eisId=219321,Effects of Oil and Gas Activities in the Arctic Ocean,Final,11/21/2016,10/21/2016,National Oceanic and Atmospheric Administration,AK,219321,Effects of Oil and Gas Activities in the Arctic Ocean,20160244,Final,2016-11-2100:00:00.0,"","","",,AK,National Oceanic and Atmospheric Administration,Jolie Harrison,301-427-8401,"",5,"",2016,2016,National Oceanic and Atmospheric Administration,20160244,20160244
https://cdxnodengn.epa.gov/cdx-enepa-II/public/action/eis/details?eisId=219344,"Lower Yellowstone Intake Diversion Dam Fish Passage Project, Montana",Final,10/27/2016,10/21/2016,U.S. Army Corps of Engineers,Multi,219344,"Lower Yellowstone Intake Diversion Dam Fish Passage Project, Montana",20160245,Final,2016-11-2100:00:00.0,"","","",,MT-ND,U.S. Army Corps of Engineers,Tiffany Vanosdall,402-995-2695,"",5,"",2016,2016,U.S. Army Corps of Engineers,20160245,20160245
https://cdxnodengn.epa.gov/cdx-enepa-II/public/action/eis/details?eisId=219548,"Amendment 37 to the Fishery Management Plan for the Snapper-Grouper Fishery of the South Atlantic Region, Modification to the Hogfish Fishery Management Unit, Fishing Level Specifications for the Two South Atlantic Hogfish Stocks, Rebuilding Plan for the Florida Keys/East Florida Stock, and Establishment/Revision of Management Measures for Both Stocks",Final,11/17/2016,10/28/2016,National Oceanic and Atmospheric Administration,Multi,219548,"Amendment 37 to the Fishery Management Plan for the Snapper-Grouper Fishery of the South Atlantic Region, Modification to the Hogfish Fishery Management Unit, Fishing Level Specifications for the Two South Atlantic Hogfish Stocks, Rebuilding Plan for the Florida Keys/East Florida Stock, and Establishment/Revision of Management Measures for Both Stocks",20160246,Final,2016-11-2800:00:00.0,"","","",,FL-GA-NC-SC,National Marine Fisheries Service,Nikhil Mehta,727-551-5098,"",5,"",2016,2016,National Oceanic and Atmospheric Administration,20160246,20160246
https://cdxnodengn.epa.gov/cdx-enepa-II/public/action/eis/details?eisId=219559,3 Bars Ecosystem and Landscape Restoration Project,Final,"",10/28/2016,Bureau of Land Management,NV,219559,3 Bars Ecosystem and Landscape Restoration Project,20160247,Final,2016-11-2800:00:00.0,"","","",,NV,Bureau of Land Management,Todd Erdody,775-635-4000,"",6,"",2016,2016,Bureau of Land Management,20160247,20160247
https://cdxnodengn.epa.gov/cdx-enepa-II/public/action/eis/details?eisId=219763,"North Cumberland Wildlife Management Area, Tennessee Lands Unsuitable for Mining Petition",Final,11/28/2016,10/28/2016,Department of Interior (other),TN,219763,"North Cumberland Wildlife Management Area, Tennessee Lands Unsuitable for Mining Petition",20160251,Final,2016-11-2800:00:00.0,"","","",,TN,Office of Surface Mining,Earl Bandy,865-545-4103,"",5,"",2016,2016,Department of Interior (other),20160251,20160251
https://cdxnodengn.epa.gov/cdx-enepa-II/public/action/eis/details?eisId=220102,State Route 79 Realignment Project: Domenigoni Parkway to Gilman Springs Road,Final,12/05/2016,11/04/2016,California Department of Transportation,CA,220102,State Route 79 Realignment Project: Domenigoni Parkway to Gilman Springs Road,20160257,Final,2016-12-0500:00:00.0,"","","",,CA,California Department of Transportation,Aaron P. Burton,909-383-2841,"",5,"",2016,2016,California Department of Transportation,20160257,20160257
